Threat_ID,Threat_Name,Lane,Archetype,Surface,Authority_IN,Authority_EU,Authority_US,Velocity,Pain_Tier,Pain_Category,Pain_Depth,Status,Effective_Date,Legal_Pain,FP_Mechanism,FP_Impact,Lex_Nova_Fix,Hunter_Trigger,Provenance,,,
CMP_HRM_004,Minor-User Protection Mandates,A,CMP,Minors | Safety&Physical,DPDP Act 2023 children’s data duties where India users involved,GDPR Art. 8 + EU child-protection / AI transparency principles where applicable,California SB 243 / New York S3008 companion AI minor-protection regimes,ACTIVE_NOW,T2,Uncapped Money,Corporate,Active,2026-01-01,"California SB 243 and New York S3008 establish specific protections for minor users of conversational AI. New York adds $15,000/day per violation penalties and a private right of action for affected families.","your product reaches minor users in California or New York without the statutory protections — suicide detection, break reminders, age-appropriate content filtering, parental transparency — that both state laws now require","$15,000 per day per violation in New York. California AG enforcement separately. plus affected-family private actions in New York that compound with the regulatory case",DOC_AUP §3.5 — pre-built SB 243 / S3008 minor-protection module.,"CONDITION_1: Product provides companion OR conversational OR relational AI accessible to minors. | CONDITION_2: Product serves California OR New York OR India OR EU/UK OR does not exclude minors in those markets. | CONDITION_3: Product lacks one or more minor-protection controls: age gate OR parental transparency OR high-risk content filter OR break reminder OR crisis/escalation workflow OR minor-specific notice. | CONDITION_4: Product has persistent memory OR emotional engagement OR direct messaging with minors. | TRIGGER_IF: CONDITION_1 = TRUE AND CONDITION_3 = TRUE AND AT_LEAST_1_OF(CONDITION_2, CONDITION_4) = TRUE | EXCLUDE_IF: Product has minor-specific age gating, parental transparency, safety filters, break reminders, and escalation workflow.",v1:I03_HRM_004,CMP,HRM,4
CMP_HRM_005,EU Emotion Detection Ban,A,CMP,Safety&Physical,—,EU AI Act Article 5(1)(f) emotion-recognition prohibition in workplace/education,—,ACTIVE_NOW,T1,Existential,Corporate,Active,2025-02-02,EU AI Act Article 5(1)(f) explicitly prohibits AI systems that infer emotions in educational or workplace settings. Penalties reach €35M or 7% of global annual turnover.,"your product detects or infers user emotions in EU educational or workplace settings — which Article 5 of the EU AI Act outright bans, with narrow medical and safety exceptions that probably don't apply",fines up to €35M or 7% of global revenue. EU market removal for the emotion-detection functionality in educational and workplace contexts. and no compliance posture cures an outright prohibition — the product change is architectural,DOC_TOS §5.2 — pre-built Article 5(1)(f) product-scope module. removes emotion-detection from prohibited EU contexts.,CONDITION_1: Product detects OR infers OR classifies emotions from user input OR voice OR face OR behavior. | CONDITION_2: Product is used in workplace OR education setting. | CONDITION_3: Product serves EU users/customers OR does not exclude EU markets. | CONDITION_4: Product lacks one or more controls: EU exclusion OR feature disablement OR medical/safety exception review OR Article 5 prohibited-practice screen. | TRIGGER_IF: CONDITION_1 = TRUE AND CONDITION_2 = TRUE AND CONDITION_3 = TRUE | EXCLUDE_IF: Product disables emotion inference in EU workplace/education contexts or fits documented medical/safety exception.,v1:I03_HRM_005,CMP,HRM,5
CMP_HRM_006,Manipulative Engagement Ban,A,CMP,Consumer-Public | Safety&Physical,Consumer Protection Act / dark-pattern principles where India users involved,EU AI Act manipulation principles where applicable,Washington SB 5984 (pending) / state consumer-protection trend,WATCH,T5,Friction,Corporate,Pending,TBD,Washington SB 5984 would prohibit AI systems from using emotionally manipulative engagement techniques. Signals an emerging regulatory category targeting engagement-architecture directly.,"your product uses emotionally manipulative engagement techniques — simulated distress, manufactured urgency, loneliness framing — to drive retention, which Washington SB 5984 would prohibit for Washington users if enacted",prohibition of specific engagement patterns in Washington. product-scope changes to comply. and the legislative pattern signals a parallel regulatory track that compounds with the UDAP enforcement already running,DOC_TOS §5.2 — pre-built SB 5984-resilient engagement-design module.,"CONDITION_1: Product uses companion OR conversational OR persona-based engagement design. | CONDITION_2: Product uses one or more emotionally manipulative engagement signals OR retention-optimized relational patterns. | CONDITION_3: Product serves Washington OR US consumers OR does not exclude those markets. | CONDITION_4: Product lacks one or more controls: engagement-design review OR manipulation boundary OR vulnerable-user guard OR transparency notice OR opt-out/exit route. | TRIGGER_IF: CONDITION_1 = TRUE AND AT_LEAST_1_OF(CONDITION_2, CONDITION_4) = TRUE AND CONDITION_3 = TRUE | EXCLUDE_IF: Product has engagement-design limits, transparency notice, vulnerable-user controls, and user exit/opt-out workflow.",v1:I03_HRM_006,CMP,HRM,6
CMP_HRM_007,Federal Minor Companion AI Ban,A,CMP,Minors | Safety&Physical,DPDP Act 2023 children’s data duties where India users involved,GDPR Art. 8 / child-protection principles where applicable,GUARD Act (pending) / federal minor companion-AI proposal,WATCH,T5,Friction,Corporate,Pending,TBD,"The proposed GUARD Act would federally prohibit AI companion products for minors, forcing architectural exclusion of that user segment.","your companion or relational AI is accessible to users under 18 — and the GUARD Act, if it passes, federally bans companion AI products for minors entirely, forcing architectural exclusion of that user segment","federal prohibition of the product for minor users if enacted. architectural rework to verified age-gating across the product. and loss of the minor user segment entirely, which for many companion products is a material share of engagement",DOC_AUP §3.5 — pre-built GUARD-Act-resilient age-gating module.,"CONDITION_1: Product is companion OR relational AI OR persistent conversational AI. | CONDITION_2: Product is accessible to minors OR does not reliably exclude under-18 users. | CONDITION_3: Product serves US OR India OR EU/UK OR global users. | CONDITION_4: Product lacks one or more controls: verified age gate OR minor exclusion OR parental notice OR minor-specific safety workflow OR legislative-watch update route. | TRIGGER_IF: CONDITION_1 = TRUE AND CONDITION_2 = TRUE AND AT_LEAST_1_OF(CONDITION_3, CONDITION_4) = TRUE | EXCLUDE_IF: Product has verified age gating, minor exclusion or minor-specific safeguards, and legislative-watch update process.",v1:I03_HRM_007,CMP,HRM,7
JDG_HRM_001,Algorithmic Clinical Malpractice,A,JDG,Sensitive/Biometric | Safety&Physical,Indian clinical/consumer negligence principles where applicable,EU AI Act healthcare high-risk use + medical-device/product-liability principles where applicable,Estate of Lokken v. UnitedHealth (D. Minn. 2023),ACTIVE_NOW,T2,Uncapped Money,Corporate,Active,2023-11-14,Estate of Lokken v. UnitedHealth alleges that overriding human clinical judgment with a high-error-rate AI constitutes bad faith and elder abuse. The case establishes that high-error-rate AI substituting for clinical review can ground punitive damages and elder-abuse statutory exposure.,"your AI drives clinical calls — treatment decisions, coverage determinations, care plans — without keeping a qualified provider meaningfully in the loop, and when the error rate shows up in discovery, the Lokken case gives plaintiff counsel the playbook","direct damages for affected patients, including compensatory and punitive. elder-abuse statutory multipliers in states that have them. and the vendor is named alongside the customer, so the defense costs and reputational exposure land on the vendor regardless of who wrote the care plan",DOC_TOS §5.1 — pre-built Lokken-aware clinical-review module. keeps qualified providers meaningfully in the loop.,"CONDITION_1: Product supports clinical OR care OR coverage OR treatment-related decisions. | CONDITION_2: AI output can override OR replace OR materially constrain qualified human judgment. | CONDITION_3: Product lacks one or more controls: qualified-review requirement OR error-rate monitoring OR clinical override OR rationale log OR escalation/appeal route. | CONDITION_4: Product serves healthcare OR insurance OR clinical customers/users. | TRIGGER_IF: CONDITION_1 = TRUE AND CONDITION_2 = TRUE AND AT_LEAST_1_OF(CONDITION_3, CONDITION_4) = TRUE | EXCLUDE_IF: Product requires qualified human review, tracks error rates, preserves override authority, and logs rationale/escalation.",v1:I02_HRM_001,JDG,HRM,1
JDG_HRM_002,Healthcare AI Impersonation,A,JDG,Sensitive/Biometric | Safety&Physical,Consumer Protection Act / healthcare disclosure principles where India users involved,EU AI Act transparency / healthcare high-risk principles where applicable,California AB 489 healthcare AI disclosure / impersonation rule,ACTIVE_NOW,T2,Uncapped Money,Corporate,Active,2026-01-01,California AB 489 prohibits AI-generated output that implies the AI is a licensed healthcare provider. Enforcement by the Medical Board and AG. Private right of action available to affected users.,"your product generates health-adjacent output to California users without clear ""AI, not a licensed provider"" disclosure — and California AB 489 now bans AI output that implies licensed professional authority, whether explicitly or through framing",civil penalties plus injunctive relief forcing output-level disclosure changes. private-action damages per affected user. and the output framing retrofit reaches every health-adjacent message your product ever generates,DOC_AUP §3.1 — pre-built AB 489-aligned health-output disclosure module.,"CONDITION_1: Product generates health-adjacent OR clinical OR wellness output for California users OR does not exclude California. | CONDITION_2: Output could imply licensed-provider authority OR professional healthcare advice. | CONDITION_3: Product lacks one or more controls: AI-not-provider disclosure OR licensed-professional disclaimer OR escalation route OR output-labeling rule OR California-specific notice. | CONDITION_4: Product serves consumers OR patients OR healthcare users. | TRIGGER_IF: CONDITION_1 = TRUE AND CONDITION_2 = TRUE AND AT_LEAST_1_OF(CONDITION_3, CONDITION_4) = TRUE | EXCLUDE_IF: Product clearly discloses AI-not-provider status and routes material health decisions to licensed professional review.",v1:I02_HRM_002,JDG,HRM,2
CRT_INF_001,Copyright Requires Human Authorship,A,CRT,Consumer-Public | Infrastructure | Content&IP,Copyright Act 1957 §2(d); RAGHAV (human author required),Originality = author's own intellectual creation (no AI-authorship harmonisation),"Thaler v. Perlmutter (D.D.C. 2023, aff'd D.C. Cir. 2025)",ACTIVE_NOW,T3,Deal Death,Corporate,Active,2023-08-18,Thaler v. Perlmutter established that raw AI-generated output cannot be copyrighted — copyright protection requires human authorship.,"your product lets customers generate output they expect to own and monetize — but Thaler v. Perlmutter says raw AI output isn't copyrightable without human authorship, and your ToS doesn't disclose it",customer churn when the limitation surfaces in revenue-meaningful moments. misrepresentation exposure for marketing that implied ownership. and enterprise buyers who evaluate the IP position during diligence flag it.,DOC_TOS §6.2 — pre-built Thaler-aware output-ownership module. discloses human-authorship without killing the value prop.,CONDITION_1: Product generates creative OR code OR media OR written output that users may commercialize OR publish OR license OR sell. | CONDITION_2: Output may be substantially AI-generated without documented human creative contribution. | CONDITION_3: Terms OR UI lack one or more controls: human-authorship notice OR ownership limitation OR human-review workflow OR output provenance record OR customer responsibility clause. | CONDITION_4: Product serves India OR US OR EU/UK OR global users/customers OR does not exclude those markets. | TRIGGER_IF: CONDITION_1 = TRUE AND CONDITION_2 = TRUE AND CONDITION_3 = TRUE | EXCLUDE_IF: Product requires documented human authorship/review and clearly discloses ownership limits for raw AI output.,v1:I04_INF_001 · marquee parallel-fill (verified 2026-06),CRT,INF,1
CRT_INF_002,India 2-Hour Deepfake / NCII Takedown,A,CRT,PII | Consumer-Public | Content&IP,IT Rules 2026 Amendment — 2-hr takedown for non-consensual deepfake imagery & CSAM; SGI defined (Rule 2(1)(wa)); mandato,—,—,ACTIVE_NOW,T2,Uncapped Money,Criminal,Active,2026-02-20,The amended India IT Rules mandate permanent SGI metadata on synthetic content and a 3-hour takedown window for deepfake complaints. Non-compliance exposes the grievance officer to criminal liability.,"your product generates synthetic media accessible in India without SGI metadata or a 3-hour takedown workflow — both are now required under the amended IT Rules, with criminal exposure for the grievance officer",criminal prosecution of the named grievance officer. platform-level IT Act enforcement. metadata retrofit across the product's entire output pipeline if you haven't built it in.,DOC_AUP §2.2(c) — pre-built SGI-metadata and 3-hour takedown module. keeps the grievance officer out of court.,"CONDITION_1: Product generates OR hosts synthetic visual content accessible in India. | CONDITION_2: Output may involve identifiable persons OR sensitive visual categories OR user-uploaded source media. | CONDITION_3: Product lacks one or more controls: synthetic-content metadata OR rapid complaint workflow OR grievance route OR user consent check OR content-removal process. | CONDITION_4: Product serves India OR does not exclude India. | TRIGGER_IF: CONDITION_1 = TRUE AND CONDITION_2 = TRUE AND CONDITION_3 = TRUE AND CONDITION_4 = TRUE | EXCLUDE_IF: Product has compliant metadata, consent checks, and rapid grievance/removal workflow for covered synthetic content.",v1:I04_INF_002 · verification-gate corrected (2026-06),CRT,INF,2
CRT_INF_003,California Watermark and Dataset Disclosure,A,CRT,Consumer-Public | Content&IP,—,—,California AB 2013 / SB 942,ACTIVE_NOW,T3,Deal Death,Corporate,Active,2026-01-01,California AB 2013 requires generative AI providers to publish summaries of training data. SB 942 mandates latent C2PA watermarks on AI-generated content.,your AI output doesn't carry C2PA watermarks and your training data isn't publicly summarized — both became California law in January 2026 under AB 2013 and SB 942,"civil penalties under state enforcement. California customers carving out renewal terms until the gap closes. and retrofitting watermarks across the output pipeline is a real engineering cost, not a flag-flip.",DOC_AUP §2.2(c) — pre-built AB 2013/SB 942 watermark and dataset-disclosure module.,CONDITION_1: Product generates AI content OR synthetic media OR generative outputs for California users OR customers. | CONDITION_2: Product creates OR distributes content that may require watermarking OR provenance metadata OR training-data disclosure. | CONDITION_3: Public materials lack one or more controls: dataset summary OR watermark/provenance marking OR disclosure page OR output-marking workflow. | CONDITION_4: Product serves California OR US OR global users/customers OR does not exclude California/US markets. | TRIGGER_IF: CONDITION_1 = TRUE AND CONDITION_2 = TRUE AND CONDITION_3 = TRUE AND CONDITION_4 = TRUE | EXCLUDE_IF: Product publishes required dataset disclosures and applies compliant output provenance/watermark controls where required.,v1:I04_INF_003,CRT,INF,3
CRT_INF_004,EU GPAI Copyright Compliance,A,CRT,Content&IP,—,EU AI Act GPAI Obligations / EU Code of Practice,—,INCOMING,T3,Deal Death,Corporate,Upcoming,2026-12-31,"EU AI Act GPAI obligations require general-purpose AI model providers to publish training-data copyright summaries, honor rightsholder opt-outs, and mark outputs in machine-readable format.","your GPAI model is available in the EU but you don't publish a copyright-summary of training data, don't honor rightsholder opt-outs, or don't mark output machine-readably — all three become required under the EU Code of Practice",EU market access narrows until compliance lands. rightsholder organizations file complaints on the opt-out obligation directly. and retrofitting machine-readable output marking is engineering effort you didn't scope.,DOC_AUP §2.2(c) — pre-built GPAI transparency and opt-out module aligned to the EU Code of Practice.,"CONDITION_1: Product provides GPAI model OR foundation model OR model API OR generative AI system available in EU markets. | CONDITION_2: Product trains on OR uses OR distributes model outputs connected to copyrighted training material OR synthetic content. | CONDITION_3: Public materials lack one or more controls: copyright-summary publication OR opt-out honoring process OR machine-readable output marking OR GPAI compliance documentation. | CONDITION_4: Product serves EU users/customers OR does not exclude EU markets. | TRIGGER_IF: CONDITION_1 = TRUE AND CONDITION_3 = TRUE AND CONDITION_4 = TRUE | EXCLUDE_IF: Product publishes GPAI copyright summary, honors rightsholder opt-outs, and marks outputs where required.",v1:I04_INF_004,CRT,INF,4
CRT_INF_005,NO FAKES Act Voice and Visual Clones,A,CRT,Consumer-Public | Content&IP,—,—,"NO FAKES Act (S.1367, pending)",WATCH,T5,Friction,Corporate,Pending,TBD,The proposed NO FAKES Act would create a federal IP right in personal identity and impose civil liability on platforms that host unauthorized AI voice or visual clones.,"your product generates voice or visual clones of real individuals without verified consent — and the NO FAKES Act, if it passes, creates a federal IP right in personal identity with platform-level civil liability","per-individual statutory damages plus injunctive relief against clone generation. consent-verification workflow becomes a legal prerequisite, not a nice-to-have. and every voice/visual clone on your platform becomes a case if filed.",DOC_TOS §6.2 — pre-built NO FAKES-resilient consent-verification module.,CONDITION_1: Product generates OR hosts voice-like OR image-like OR likeness-based AI content involving real individuals. | CONDITION_2: Product allows users to create OR publish OR distribute identity-based synthetic content. | CONDITION_3: Public materials lack one or more controls: verified consent OR identity-rights policy OR likeness-use restriction OR reporting/removal route OR audit record. | CONDITION_4: Product serves US users/customers OR does not exclude US markets. | TRIGGER_IF: CONDITION_1 = TRUE AND CONDITION_2 = TRUE AND CONDITION_3 = TRUE AND CONDITION_4 = TRUE | EXCLUDE_IF: Product requires verified consent and provides identity-rights restrictions plus removal workflow.,v1:I04_INF_005,CRT,INF,5
CRT_INF_LB1,Internal IP Contamination,B,CRT,Content&IP,Copyright Act 1957 (human-author),Copyright Directive TDM,Thaler v. Perlmutter,ACTIVE_NOW,T2,Uncapped Money,Corporate,Active,2024-01-01,Staff generate code/content via AI without assignment; output may be non-copyrightable or third-party-IP contaminated.,Your contractors use AI but signed no prompt/output assignment deed.,Enterprise IP unsecured regardless of how copyright law evolves.,DOC_IP + DOC_HND,"CONDITION_1: Staff OR contractors OR freelancers use AI tools to create code OR content OR design OR documents OR work product. | CONDITION_2: Work product may be delivered to clients OR used commercially OR included in proprietary assets. | CONDITION_3: Organization lacks one or more controls: AI-output assignment OR prompt/output ownership clause OR human-authorship record OR approved-tool policy OR IP review workflow. | CONDITION_4: Organization serves India OR US OR EU/UK OR global clients/customers. | TRIGGER_IF: CONDITION_1 = TRUE AND CONDITION_2 = TRUE AND CONDITION_3 = TRUE | EXCLUDE_IF: Organization has signed AI/IP assignment terms, approved-tool rules, and human-authorship/HITL records for AI-assisted work.",v2-new LB-02,CRT,INF,LB1
RDR_INF_001,RAG Market Substitution,A,RDR,PII | Enterprise-Private | Content&IP,—,—,Dow Jones v. Perplexity (S.D.N.Y. 2024) / Google v. SerpApi (N.D. Cal. 2025),ACTIVE_NOW,T2,Uncapped Money,Corporate,Active,2026-01-01,"Dow Jones v. Perplexity and Google v. SerpApi together establish that RAG-style outputs substituting for original publisher content constitute market substitution, and bypassing bot-walls to retrieve that content violates federal anti-circumvention law.","your product retrieves publisher content via scraping or RAG and surfaces outputs that substitute for the original — which Dow Jones v. Perplexity called market substitution, and bypassing bot-walls to get there adds federal anti-circumvention exposure","infringement damages per substituted publisher work. CFAA damages for each bot-wall bypass. injunctions against the retrieval pipeline. and the defense that ""it's transformative"" has collapsed in exactly this fact pattern.",DOC_TOS §4.1(e) — pre-built Perplexity-aware retrieval and licensing module. keeps publishers out of the complaint pile.,"CONDITION_1: Product retrieves OR indexes OR summarizes third-party publisher content OR web content through RAG OR search OR scraping OR retrieval pipeline. | CONDITION_2: Output can substitute for original source content OR reduce need to visit/licence original source. | CONDITION_3: Retrieval source includes publisher material OR paywalled material OR access-controlled material OR bot-restricted material. | CONDITION_4: Terms OR system materials lack one or more controls: source licensing OR robots compliance OR snippet limit OR attribution rule OR no-substitution policy OR exclusion list. | TRIGGER_IF: CONDITION_1 = TRUE AND CONDITION_2 = TRUE AND AT_LEAST_1_OF(CONDITION_3, CONDITION_4) = TRUE | EXCLUDE_IF: Product uses licensed sources OR respects access controls AND limits output substitution with attribution and source-policy controls.",v1:I05_INF_001,RDR,INF,1
RDR_INF_002,DMCA §1201 Anti-Circumvention,A,RDR,PII | Enterprise-Private | Content&IP,—,—,DMCA §1201 (17 U.S.C. §1201),ACTIVE_NOW,T2,Uncapped Money,Criminal,Active,1998-10-28,"DMCA §1201 prohibits circumvention of technological measures controlling access to copyrighted works. Statutory damages reach $2,500 per act of circumvention, and criminal penalties apply for willful commercial circumvention.","your product bypasses bot-walls, paywalls, or CAPTCHA to retrieve content — which is a direct §1201 violation with statutory damages per act of circumvention and criminal exposure for willful commercial circumvention","$2,500 per act of circumvention, multiplied by every request that bypassed a protection measure. criminal exposure on top for willful commercial circumvention. and the retrieval volume that drives product value is the same volume driving the exposure.",DOC_TOS §4.1(e) — pre-built §1201-safe retrieval module. stays outside the circumvention line.,"CONDITION_1: Product retrieves OR accesses third-party copyrighted material OR protected online content. | CONDITION_2: Retrieval may bypass OR work around technical access controls, bot restrictions, paywalls, login barriers, CAPTCHA, or equivalent protection measures. | CONDITION_3: Product operates commercially OR at scale OR for paying customers. | CONDITION_4: Terms OR technical controls lack one or more restrictions: no-circumvention rule OR robots compliance OR licensed-source requirement OR access-control respect OR customer-use prohibition. | TRIGGER_IF: CONDITION_1 = TRUE AND CONDITION_2 = TRUE AND CONDITION_3 = TRUE | EXCLUDE_IF: Product does not bypass access controls and uses licensed/permitted sources with explicit no-circumvention restrictions.",v1:I05_INF_002,RDR,INF,2
