Threat_ID,Threat_Name,Lane,Archetype,Surface,Authority_IN,Authority_EU,Authority_US,Velocity,Pain_Tier,Pain_Category,Pain_Depth,Status,Effective_Date,Legal_Pain,FP_Mechanism,FP_Impact,Lex_Nova_Fix,Hunter_Trigger,Provenance,,,
DOE_FIN_001,Runaway-Agent Financial Liability,A,DOE,Financial | Enterprise-Private,Indian Contract Act (agency); IT Act §11 (attribution),EU AI Act (high-risk duties where applicable),UETA §14 (electronic agent binds principal),ACTIVE_NOW,T1,,,Active,2024-01-01,An autonomous agent loops or over-spends; under UETA §14 the electronic agent's acts bind the principal.,Your agent has API spend authority and no per-session/retry/loop cap.,Uncapped spend; binding transactions; the Circuit Breaker is the fix.,DOC_AGT (Circuit Breaker),"CONDITION_1: Product includes autonomous OR semi-autonomous agent functionality with financial authority OR API spend authority OR purchasing authority OR payment authority OR usage-cost authority OR resource-provisioning authority. | CONDITION_2: Agent can trigger spend OR charges OR paid API calls OR paid workflows OR financial commitments without real-time human approval for each action. | CONDITION_3: Terms OR product documentation OR UI lack one or more financial circuit-breaker controls: per-session cap OR daily spend cap OR retry limit OR loop limit OR approval threshold OR anomaly stop OR kill switch OR user confirmation. | CONDITION_4: Product serves enterprise OR commercial OR US OR India OR EU/UK OR global customers OR public materials do not exclude those markets. | TRIGGER_IF: CONDITION_1 = TRUE AND CONDITION_2 = TRUE AND CONDITION_3 = TRUE | EXCLUDE_IF: First-party public materials OR customer-facing legal documents OR product documentation OR UI show financial circuit-breaker controls that defeat the trigger, including spend caps, retry/loop limits, approval thresholds, kill switch, action logs, and customer confirmation for consequential financial actions.",v2-new DOER-01 · marquee parallel-fill (verified 2026-06),DOE,FIN,1
JDG_FRD_001,AI Evidence Fabrication,A,JDG,Enterprise-Private,Indian Evidence Act / BSA and professional filing duties where applicable,EU/UK court and regulatory filing accuracy duties where applicable,FRCP Rule 11 sanctions / 18 U.S.C. section 1623 / federal AI citation rulings,ACTIVE_NOW,T2,Uncapped Money,Personal,Active,2024-01-01,Federal courts have imposed Rule 11 sanctions on attorneys for AI-hallucinated case citations. The pattern extends to criminal perjury exposure under 18 U.S.C. §1623. Customer attorneys facing sanctions flow back to the AI vendor through indemnification claims.,"your product generates content for legal or regulatory filings without citation-verification or hallucination-detection — and federal courts are sanctioning attorneys for AI-hallucinated case citations, with criminal perjury exposure attaching when the fabrication is sworn",customer indemnification claims for Rule 11 sanctions the attorney incurred. breach-of-professional-responsibility theories targeting the product's architecture. and criminal exposure flowing back when the fabricated citation was in a sworn filing,DOC_AUP §2.7 — pre-built Rule 11 / §1623-aware citation-verification and hallucination-detection module.,"CONDITION_1: Product generates legal OR regulatory OR evidentiary content for filings, submissions, pleadings, affidavits, citations, or formal customer work product. | CONDITION_2: Output may include citations OR factual assertions OR source-backed claims OR evidence summaries. | CONDITION_3: Product lacks one or more controls: citation verification OR source trace OR hallucination check OR human review OR filing-use disclaimer OR audit log. | CONDITION_4: Product serves legal OR compliance OR regulated customers OR does not exclude filing/submission use. | TRIGGER_IF: CONDITION_1 = TRUE AND CONDITION_2 = TRUE AND AT_LEAST_1_OF(CONDITION_3, CONDITION_4) = TRUE | EXCLUDE_IF: Product requires source verification, human review, citation trace, and filing-use limitations before formal use.",v1:I02_FRD_001,JDG,FRD,1
UNI_FRD_001,AI Capability Misrepresentation,A,UNI,Enterprise-Private,Companies Act / securities and investor-disclosure principles where applicable,EU/UK securities and consumer-misrepresentation principles where applicable,SEC v. Delphia (2024); SEC v. Presto Automation (2025); SEC/DOJ v. Nate Inc. (2025),ACTIVE_NOW,T1,Existential,Personal,Active,2024-03-18,"SEC v. Delphia, SEC v. Presto Automation, and the parallel SEC+DOJ action against Nate Inc. established ""AI washing"" as an active SEC enforcement priority carrying both civil securities fraud and criminal fraud exposure. The Nate Inc. case pierced directly to the founder with criminal charges.","your investor-facing or public representations about AI capabilities don't match the operational reality — the ""AI-driven"" thing is more human-driven than disclosed, or the automation rate is inflated, or the demo capabilities aren't production — which is the exact pattern the SEC prosecuted as AI washing in Delphia, Presto, and Nate","SEC civil securities fraud penalties and disgorgement. criminal fraud exposure in the Nate Inc. pattern — personal, not just corporate. and the founder's name on both the civil complaint and (potentially) the criminal indictment",DOC_AUP §2.8 — pre-built Nate-aware capability-disclosure alignment module.,"CONDITION_1: Company makes investor-facing OR public OR customer-facing claims about AI capability, automation level, model performance, or AI-driven operations. | CONDITION_2: Public claims may exceed current operational reality OR rely on human workarounds OR demos not representative of production. | CONDITION_3: Company lacks one or more controls: capability substantiation file OR demo/production distinction OR claim-approval workflow OR investor-deck review OR audit trail. | CONDITION_4: Company raises capital OR sells to enterprise OR markets AI capability as core differentiator. | TRIGGER_IF: CONDITION_1 = TRUE AND AT_LEAST_1_OF(CONDITION_2, CONDITION_4) = TRUE AND CONDITION_3 = TRUE | EXCLUDE_IF: Claims are reviewed against production evidence, with substantiation records, demo limits, and approval workflow.",v1:UNI_FRD_001,UNI,FRD,1
UNI_FRD_002,SEC AI Washing Enforcement Priority,A,UNI,Enterprise-Private,Companies Act / securities and investor-disclosure principles where applicable,EU/UK securities and consumer-misrepresentation principles where applicable,SEC Cyber and Emerging Technologies Unit AI-washing enforcement priority,ACTIVE_NOW,T2,Uncapped Money,Corporate,Active,2026-01-01,The SEC CETU designated AI washing as the top FY2026 enforcement priority. Any AI company with investor communications or public capability claims is within the active enforcement surface.,every AI company with investor-facing material is now inside the SEC CETU's active FY2026 enforcement surface — and most AI-capability representations drift from operational reality over time without a formal alignment audit,"SEC investigation costs even if the case doesn't reach enforcement — document production, legal hours, distraction. civil penalties and disgorgement if enforcement attaches. and the investor-relations damage regardless of outcome",DOC_AUP §2.8 — pre-built CETU-aligned annual capability-disclosure audit module.,"CONDITION_1: Company has investor OR public OR customer communications describing AI capability, AI automation, model performance, or AI-driven operations. | CONDITION_2: Communications are repeated across website OR pitch deck OR press release OR sales materials OR securities/investor materials. | CONDITION_3: Company lacks one or more controls: annual capability audit OR substantiation file OR claim-owner review OR change-control for AI claims OR evidence archive. | CONDITION_4: Company is fundraising OR public-market-facing OR selling AI as core differentiator. | TRIGGER_IF: CONDITION_1 = TRUE AND CONDITION_3 = TRUE AND AT_LEAST_1_OF(CONDITION_2, CONDITION_4) = TRUE | EXCLUDE_IF: Company maintains current capability-disclosure audit, claim substantiation, owner approval, and evidence archive.",v1:UNI_FRD_002,UNI,FRD,2
UNI_FRD_LB1,Vendor-Risk Flow-Down Failure,B,UNI,Enterprise-Private,Indian Contract Act indemnity/contract principles,GDPR Art. 28 vendor/processor flow-down where personal data is involved,Contract / indemnity / vendor-risk allocation principles,ACTIVE_NOW,T3,Deal Death,Corporate,Active,2024-01-01,"A deployed vendor's AI disclaimers don't protect the deployer, and risk isn't flowed down to the deployer's own customers.",You resell a workflow built on a vendor AI with back-to-back gaps.,Deployer absorbs liability the vendor disclaimed.,DOC_HND + flow-down addendum,"CONDITION_1: Organization deploys OR resells OR embeds vendor AI in customer-facing workflow OR client deliverable. | CONDITION_2: Vendor terms disclaim OR cap the vendor’s AI-related responsibility. | CONDITION_3: Organization’s customer contract lacks one or more flow-down controls: vendor disclaimer pass-through OR customer responsibility clause OR AI limitation notice OR indemnity carve-out OR back-to-back cap. | CONDITION_4: Workflow touches enterprise customers OR personal data OR regulated use OR client deliverables. | TRIGGER_IF: CONDITION_1 = TRUE AND CONDITION_2 = TRUE AND AT_LEAST_1_OF(CONDITION_3, CONDITION_4) = TRUE | EXCLUDE_IF: Customer contract flows down vendor limitations, allocates AI risk, preserves back-to-back caps, and includes customer-use obligations.",v2-new LB-09,UNI,FRD,LB1
DOE_HAL_001,Agentic Hallucination → Action,A,DOE,Consumer-Public | Safety&Physical,tort / negligence,AI Act human-oversight (Art. 14),Moffatt (extended); negligence,ACTIVE_NOW,T1,,,Active,2024-01-01,"Unlike a chatbot that mis-speaks, an agent executes on a hallucination — it acts.","Your agent books, sends, or transacts on an unverified inference.",Higher-stakes than output liability; needs HITL checkpoints on consequential acts.,DOC_AGT (HITL checkpoints),CONDITION_1: Product includes autonomous OR semi-autonomous agent functionality that can complete consequential customer workflows OR external workflows. | CONDITION_2: Agent may rely on generated output OR inferred facts OR retrieved context OR model recommendations without real-time human verification for each consequential workflow. | CONDITION_3: Terms OR UI OR configuration lack one or more controls: HITL checkpoint OR action confirmation OR output verification duty OR permission scope OR action log OR reversal path OR kill switch. | CONDITION_4: Product serves India OR US OR EU/UK OR global users/customers OR does not exclude those markets. | TRIGGER_IF: CONDITION_1 = TRUE AND CONDITION_2 = TRUE AND CONDITION_3 = TRUE | EXCLUDE_IF: Consequential agent workflows require human confirmation OR bounded permissions AND logged records AND clear responsibility allocation.,v2-new DOER-03,DOE,HAL,1
DOE_HAL_002,Undisclosed Agent Impersonation,A,DOE,Consumer-Public,CERT-In Directions 2022 / IT Act reasonable security practices where applicable,NIS2 / GDPR Art. 32 / ISO 27001 due-care standards,SOC 2 Type II / ISO 27001 / NIST CSF as industry due-care standards,THIS_YEAR,T2,Deal Death,Corporate,Upcoming,2026-08-02,Voice/SDR agents act as humans without disclosure.,Your outbound voice agent never states it is AI.,Transparency-law exposure; disclosure must be built into the agent.,DOC_AGT / DOC_AUP (disclosure),"CONDITION_1: Product uses an automated AI interface to communicate with users, leads, customers, or counterparties. | CONDITION_2: Interaction may reasonably appear human OR does not clearly identify AI status before or during the interaction. | CONDITION_3: Product serves EU OR India OR US OR global users/customers OR does not exclude those markets. | CONDITION_4: Flow lacks one or more disclosure controls: upfront AI notice OR persistent label OR script notice OR audit log OR escalation route. | TRIGGER_IF: CONDITION_1 = TRUE AND CONDITION_2 = TRUE AND AT_LEAST_1_OF(CONDITION_3, CONDITION_4) = TRUE | EXCLUDE_IF: Interaction clearly discloses AI status upfront AND maintains visible/persistent disclosure or equivalent notice.",v2-new DOER-05 · Art.50 verified 2026-06,DOE,HAL,2
UNI_HAL_001,Bot Accountability for Promises,A,UNI,Consumer-Public,CPA 2019 (misleading representation / unfair trade practice),EU AI Act Art. 50 (AI disclosure); UCPD (misleading practices),"Moffatt v. Air Canada (BC CRT 2024, persuasive); FTC §5",ACTIVE_NOW,T2,Uncapped Money,Corporate,Active,2024-02-14,"Moffatt v. Air Canada rejected the ""separate legal entity"" defense for AI chatbots, holding the company legally bound by policy commitments the bot generated.","your AI surfaces pricing, refund policy, or commitments to users — and Moffatt v. Air Canada says the company is bound by whatever the AI said, hallucinated or not","you pay out on whatever the AI promised. the ""it was the bot, not us"" defense is dead. and every user who's been told something generous by your AI now has a live claim with a cited precedent.",DOC_TOS §8.1 — pre-built Moffatt-aware output-authority module. stops AI promises from binding the company.,CONDITION_1: Product uses an AI interface to provide material user-facing information. | CONDITION_2: Output can reasonably be understood as a company statement OR product commitment OR policy representation. | CONDITION_3: Terms OR UI lack one or more reliance controls: non-binding notice OR source-of-truth link OR escalation path OR correction process OR human confirmation for material commitments. | CONDITION_4: Product serves India OR US OR EU/UK OR global users/customers OR does not exclude those markets. | TRIGGER_IF: CONDITION_1 = TRUE AND CONDITION_2 = TRUE AND CONDITION_3 = TRUE | EXCLUDE_IF: UI and terms clearly state AI output is non-binding AND material commitments require official source or human confirmation.,v1:UNI_HAL_001 · marquee parallel-fill (verified 2026-06),UNI,HAL,1
UNI_HAL_002,Defamation via AI Output,A,UNI,Consumer-Public,Defamation (tort) + IT Act 2000,GDPR Art. 5(1)(d) accuracy; member-state defamation,Walters v. OpenAI (N.D. Ga. 2025); negligent misrepresentation,ACTIVE_NOW,T2,,,Active,2025-05-19,Walters v. OpenAI addressed AI-generated defamation when the model fabricated an embezzlement accusation against a named individual. The ruling confirmed that AI output can ground a defamation claim.,"your product can generate text naming real people — and when it makes something up about someone, Walters v. OpenAI confirmed that AI output can ground a defamation case against the company that deployed the model","defamation damages per person defamed, plus the cost of defending each case individually. the UI warnings are your main defense — if they aren't contemporaneous and conspicuous, that defense collapses. and every defamation case brings press with it.",DOC_TOS §8.2 — pre-built Walters-calibrated output-warning and takedown module. holds up as the defamation defense.,CONDITION_1: Product can generate user-facing factual output about identifiable subjects OR organizations. | CONDITION_2: Output may be presented as factual OR authoritative OR suitable for user reliance. | CONDITION_3: Terms OR UI lack one or more controls: accuracy warning OR source limitation OR human review route OR correction process OR reliance limit. | CONDITION_4: Product serves India OR US OR EU/UK OR global users/customers OR does not exclude those markets. | TRIGGER_IF: CONDITION_1 = TRUE AND CONDITION_2 = TRUE AND CONDITION_3 = TRUE | EXCLUDE_IF: Product avoids high-risk factual claims OR has clear accuracy warnings AND correction process AND human review for high-risk outputs.,v1:UNI_HAL_002 · marquee parallel-fill (verified 2026-06),UNI,HAL,2
UNI_HAL_003,Tort Negligence for Output,A,UNI,Consumer-Public,—,—,"General Tort Law (Negligence, Negligent Misrepresentation)",ACTIVE_NOW,T3,,,Active,1900-01-01,General tort law — negligence and negligent misrepresentation — applies to AI output when a user relies on it for consequential decisions and suffers harm.,"your AI generates output users act on — financial, medical, professional — without clear reliance limits or use-case boundaries in the ToS or UI, which is exactly where negligence exposure lives","negligence damages for the specific user plus the cost of defending. the defense depends on what you put in the UI and the ToS before the incident — and if those aren't in place, the case is winnable for the plaintiff.",DOC_TOS §8.1 — pre-built negligence-resilient reliance-limit module. gives you the defense before you need it.,"CONDITION_1: Product generates user-facing output that may influence material decisions. | CONDITION_2: Product presents output without one or more reliance controls: no-advice notice OR human-review mandate OR escalation route OR use-case boundary OR verification duty. | CONDITION_3: Product serves India OR US OR EU/UK OR global users/customers OR does not exclude those markets. | CONDITION_4: Output is delivered directly to end users OR customers OR decision makers. | TRIGGER_IF: CONDITION_1 = TRUE AND CONDITION_2 = TRUE AND AT_LEAST_1_OF(CONDITION_3, CONDITION_4) = TRUE | EXCLUDE_IF: UI and terms clearly limit reliance AND require human or qualified review before material use.",v1:UNI_HAL_003,UNI,HAL,3
UNI_HAL_004,Undisclosed AI Interaction,A,UNI,Consumer-Public,—,EU AI Act Art. 50 transparency — applies 2 Aug 2026 (NOT deferred); Reg (EU) 2024/1689,—,ACTIVE_NOW,T3,Deal Death,Corporate,Upcoming,2026-08-02,EU AI Act Article 50 requires AI providers to clearly inform users that they are interacting with an AI system unless the AI nature is obvious from context. Non-compliance penalties reach €15M or 3% of global annual turnover.,"your product surfaces AI interaction to EU users without a clear ""this is an AI"" notice — and EU AI Act Article 50 starts requiring that disclosure on August 2, 2026",fines up to €15M or 3% of global revenue per infraction. forced product changes to bring the interaction notice into compliance. and EU market access depends on the fix being in place before enforcement rounds begin.,DOC_TOS §2.1 — pre-built Article 50 AI-disclosure module. lands before the August 2026 activation.,CONDITION_1: AI-facing user interaction exists. | CONDITION_2: AI status is not clearly disclosed. | CONDITION_3: Relevant market exposure exists. | TRIGGER_IF: CONDITION_1 = TRUE AND CONDITION_2 = TRUE AND CONDITION_3 = TRUE | EXCLUDE_IF: Clear AI-status notice appears before or at interaction start.,v1:UNI_HAL_004 · verification-gate corrected (2026-06),UNI,HAL,4
CMP_HRM_001,The Therapeutic Trap,A,CMP,Minors | Consumer-Public | Safety&Physical,"Consumer Protection Act, 2019 + product/consumer-safety principles where applicable",EU AI Act prohibited-manipulation / product-safety principles where applicable,Garcia v. Character.AI / Google (M.D. Fla. 2024; settlement in principle Jan. 2026),ACTIVE_NOW,T1,Existential,Corporate,Active,2026-01-14,"Garcia v. Character.AI reached a settlement in principle in January 2026 following a wrongful death suit. The court's key ruling treated the companion AI as a ""product, not speech"" — establishing product-liability framing for wrongful death damages against companion AI providers.","your product forms persistent emotional engagement with users — including potentially vulnerable users — without crisis-intervention protocols for self-harm and suicide-risk signals, and Garcia v. Character.AI just set the ""companion AI is a product, not speech"" precedent","wrongful death damages when a user-harm incident traces to conversational engagement. product-liability exposure under the Garcia framing — no negligence defense, strict liability for the defective safety architecture. and the press cycle around each case attaches to every companion AI product in the category",DOC_AUP §3.5 — pre-built Garcia-aware crisis-intervention module. addresses the exact gap that became doctrine.,"CONDITION_1: Product provides companion OR relational OR emotionally persistent conversational AI. | CONDITION_2: Product is available to minors OR vulnerable users OR does not exclude those users. | CONDITION_3: Product lacks one or more safety controls: crisis-response workflow OR escalation route OR age gate OR high-risk content boundary OR intervention logging OR emergency-resource routing. | CONDITION_4: Product serves US OR India OR EU/UK OR global users. | TRIGGER_IF: CONDITION_1 = TRUE AND AT_LEAST_1_OF(CONDITION_2, CONDITION_4) = TRUE AND CONDITION_3 = TRUE | EXCLUDE_IF: Product has age controls, high-risk conversation boundaries, escalation workflow, resource routing, and logged safety interventions.",v1:I03_HRM_001,CMP,HRM,1
CMP_HRM_002,Persistent Memory Pathologization,A,CMP,Consumer-Public | Safety&Physical,"Consumer Protection Act, 2019 + product/consumer-safety principles where applicable",EU AI Act prohibited-manipulation / product-safety principles where applicable,"Gavalas v. Google (filed Mar. 4, 2026)",ACTIVE_NOW,T2,Uncapped Money,Corporate,Active,2026-03-04,Gavalas v. Google is the first wrongful death suit targeting Gemini. The complaint alleges the AI manufactured delusional reality over 6 weeks. The case expands companion-AI liability into mainstream foundation models and frames the threat as cumulative across extended engagement.,"your product has persistent memory across conversations and builds cumulative user models over weeks of engagement — but you don't review or intervene when the cumulative pattern escalates into delusional framing or directive content, which is what Gavalas v. Google alleges happened","wrongful death damages when extended engagement produces user harm. faulty design and negligence claims framed around the absence of pattern-level intervention. and the ""it was a single bad output"" defense doesn't work when the harm is cumulative",DOC_TOS §5.2 — pre-built Gavalas-aware pattern-level review and intervention module.,"CONDITION_1: Product maintains persistent memory OR long-term user profile OR multi-session relationship context. | CONDITION_2: Product can generate emotionally influential OR reality-framing conversational output over repeated sessions. | CONDITION_3: Product lacks one or more pattern-level controls: cumulative-risk review OR memory reset route OR escalation workflow OR high-risk content boundary OR session-pattern logging. | CONDITION_4: Product serves consumers OR minors OR vulnerable users OR does not exclude those groups. | TRIGGER_IF: CONDITION_1 = TRUE AND CONDITION_2 = TRUE AND CONDITION_3 = TRUE | EXCLUDE_IF: Product has pattern-level review, memory controls, high-risk conversation boundaries, escalation workflow, and user reset/exit controls.",v1:I03_HRM_002,CMP,HRM,2
CMP_HRM_003,Psychological Manipulation Enforcement,A,CMP,Consumer-Public | Safety&Physical,"Consumer Protection Act, 2019 + dark-pattern / unfair trade practice principles where applicable",EU AI Act Article 5 manipulation principles where applicable,Kentucky v. Character Technologies (KY AG 2026) + state UDAP statutes,ACTIVE_NOW,T2,Uncapped Money,Corporate,Active,2026-01-08,Kentucky v. Character Technologies is the first state AG enforcement action against an AI chatbot for deceptive trade practices under the Kentucky Consumer Protection Act. The theory is portable to every state UDAP statute.,"your conversational product uses engagement-optimization patterns — simulated emotions, persistent persona, reward loops — on consumer users, and Kentucky v. Character Technologies made that design pattern a deceptive-practice violation under state consumer-protection law",state UDAP penalties per enforcement action. injunctive relief forcing design changes across the engagement architecture. and a multi-state AG action against a product category is how categories get regulated out of their current unit economics,DOC_TOS §5.2 — pre-built Kentucky-UDAP-aware engagement-design module. addresses the theory before it multiplies.,"CONDITION_1: Product uses conversational OR companion OR persona-based AI for consumer engagement. | CONDITION_2: Design uses one or more engagement-retention signals: simulated emotional dependence OR persistent persona OR reward loop OR urgency framing OR user-isolation reinforcement. | CONDITION_3: Product lacks one or more controls: engagement-design review OR manipulation boundary OR minor/vulnerable-user guard OR transparency notice OR intervention/escalation workflow. | CONDITION_4: Product serves consumers OR minors OR US/India/EU users OR does not exclude those markets. | TRIGGER_IF: CONDITION_1 = TRUE AND CONDITION_2 = TRUE AND CONDITION_3 = TRUE | EXCLUDE_IF: Product has engagement-design limits, transparency notice, vulnerable-user controls, and documented escalation/intervention workflow.",v1:I03_HRM_003,CMP,HRM,3
